{
  "$schema": "https://json-schema.org/draft/2020-12/schema",
  "$id": "https://agentpass.dev/contracts/refresh-hint-v1.schema.json",
  "title": "AgentPass refresh hint v1",
  "type": "object",
  "additionalProperties": false,
  "required": [
    "version",
    "type",
    "organization_id",
    "device_id",
    "authority_generation",
    "published_at",
    "expires_at",
    "nonce",
    "key_id",
    "signature_algorithm",
    "signature"
  ],
  "properties": {
    "version": { "const": 1 },
    "type": { "const": "agentpass.refresh-hint" },
    "organization_id": { "$ref": "#/$defs/uuid" },
    "device_id": { "$ref": "#/$defs/uuid" },
    "authority_generation": { "$ref": "#/$defs/safeInteger" },
    "published_at": { "$ref": "#/$defs/timestamp" },
    "expires_at": { "$ref": "#/$defs/timestamp" },
    "nonce": { "$ref": "#/$defs/nonce" },
    "key_id": { "$ref": "#/$defs/keyId" },
    "signature_algorithm": { "const": "ed25519" },
    "signature": { "$ref": "#/$defs/signature" }
  },
  "$defs": {
    "uuid": {
      "type": "string",
      "format": "uuid",
      "pattern": "^[0-9a-f]{8}-[0-9a-f]{4}-[1-8][0-9a-f]{3}-[89ab][0-9a-f]{3}-[0-9a-f]{12}$"
    },
    "safeInteger": {
      "type": "integer",
      "minimum": 1,
      "maximum": 9007199254740991
    },
    "timestamp": {
      "type": "string",
      "minLength": 24,
      "maxLength": 24,
      "format": "date-time",
      "pattern": "^\\d{4}-\\d{2}-\\d{2}T\\d{2}:\\d{2}:\\d{2}\\.\\d{3}Z$"
    },
    "nonce": {
      "type": "string",
      "minLength": 22,
      "maxLength": 22,
      "pattern": "^[A-Za-z0-9_-]{21}[AQgw]$"
    },
    "keyId": {
      "type": "string",
      "minLength": 1,
      "maxLength": 64,
      "pattern": "^[A-Za-z0-9][A-Za-z0-9._:-]{0,63}$"
    },
    "signature": {
      "type": "string",
      "minLength": 86,
      "maxLength": 86,
      "pattern": "^[A-Za-z0-9_-]{85}[AEIMQUYcgkosw048]$"
    }
  }
}
